{"$schema":"https://json-schema.org/draft/2020-12/schema","type":"object","additionalProperties":false,"required":["protocol","skill_slug","method_version","compute_profile","as_of","parameters","dataset_refs","status","metrics","rows","row_delivery","research_summary","limitations","research_only","provenance"],"properties":{"protocol":{"const":"cpu_bounded_v1"},"skill_slug":{"const":"equity-risk-premium-timing"},"method_version":{"const":"1.0.0"},"compute_profile":{"const":"cpu_bounded_v1"},"as_of":{"type":"string","format":"date"},"parameters":{"type":"object","additionalProperties":false,"required":["quantile_window","lower_quantile","upper_quantile"],"properties":{"quantile_window":{"type":"integer"},"lower_quantile":{"type":"number"},"upper_quantile":{"type":"number"}}},"dataset_refs":{"$ref":"#/$defs/dataset_refs"},"status":{"enum":["complete","partial"]},"metrics":{"type":"object","additionalProperties":false,"required":["sample_size","signal_observations","latest_risk_premium","latest_percentile","latest_research_signal"],"properties":{"sample_size":{"type":"integer"},"signal_observations":{"type":"integer"},"latest_risk_premium":{"type":"number"},"latest_percentile":{"type":"number","minimum":0,"maximum":1},"latest_research_signal":{"enum":["elevated_risk_premium","middle_risk_premium","compressed_risk_premium"]}}},"rows":{"type":"array","items":{"type":"object","additionalProperties":false,"required":["date","index_close","pe_ttm","bond_yield_pct","risk_premium","rolling_percentile","research_signal"],"properties":{"date":{"type":"string","format":"date"},"index_close":{"type":"number"},"pe_ttm":{"type":"number"},"bond_yield_pct":{"type":"number"},"risk_premium":{"type":"number"},"rolling_percentile":{"type":"number"},"research_signal":{"type":"string"}}}},"row_delivery":{"$ref":"#/$defs/row_delivery"},"research_summary":{"$ref":"#/$defs/research_summary"},"limitations":{"type":"array","items":{"type":"string"}},"research_only":{"const":true},"provenance":{"$ref":"#/$defs/provenance"}},"$defs":{"dataset_refs":{"type":"array","minItems":1,"maxItems":32,"items":{"$ref":"#/$defs/dataset_ref"}},"dataset_ref":{"type":"object","additionalProperties":false,"required":["dataset_id","provider_id","as_of","sha256"],"properties":{"dataset_id":{"type":"string"},"provider_id":{"enum":["synthetic","user_input"]},"as_of":{"type":"string","format":"date"},"sha256":{"type":"string","pattern":"^[0-9a-f]{64}$"}}},"row_delivery":{"type":"object","additionalProperties":false,"required":["mode","processed_input_rows","inline_output_rows","omitted_output_rows","dataset_refs_reused"],"properties":{"mode":{"enum":["inline","summary_with_dataset_refs"]},"processed_input_rows":{"type":"integer"},"inline_output_rows":{"type":"integer","maximum":128},"omitted_output_rows":{"type":"integer"},"dataset_refs_reused":{"const":true}}},"research_summary":{"type":"object","additionalProperties":false,"required":["sample_size","conditions","counterexamples","failure_conditions","data_cutoff"],"properties":{"sample_size":{"type":"integer"},"conditions":{"type":"array","items":{"type":"string"}},"counterexamples":{"type":"array","items":{"type":"string"}},"failure_conditions":{"type":"array","items":{"type":"string"}},"data_cutoff":{"type":"string","format":"date"}}},"provenance":{"type":"object","additionalProperties":false,"required":["dataset_refs","source_hashes","rights","transformations"],"properties":{"dataset_refs":{"$ref":"#/$defs/dataset_refs"},"source_hashes":{"type":"object","maxProperties":32,"additionalProperties":{"type":"string","pattern":"^[0-9a-f]{64}$"}},"rights":{"const":"internal-only"},"transformations":{"type":"array","items":{"type":"string"}}}}}}
