{"as_of":"2026-09-16","compute_profile":"cpu_bounded_v1","dataset_refs":[{"as_of":"2026-09-16","dataset_id":"fixture-equity-risk-premium","provider_id":"synthetic","sha256":"9fd07f7c6c8dfedd9c2b1d4eaa69183ffa557ca13ab78c6e706b59712bafcaf0"}],"limitations":["research_signal_only_not_an_order_or_trade_instruction","empirical_rank_is_window_dependent"],"method_version":"1.0.0","metrics":{"latest_percentile":1.0,"latest_research_signal":"elevated_risk_premium","latest_risk_premium":0.0375,"sample_size":5,"signal_observations":3},"parameters":{"lower_quantile":0.2,"quantile_window":3,"upper_quantile":0.8},"protocol":"cpu_bounded_v1","provenance":{"dataset_refs":[{"as_of":"2026-09-16","dataset_id":"fixture-equity-risk-premium","provider_id":"synthetic","sha256":"9fd07f7c6c8dfedd9c2b1d4eaa69183ffa557ca13ab78c6e706b59712bafcaf0"}],"rights":"internal-only","source_hashes":{"synthetic":"9fd07f7c6c8dfedd9c2b1d4eaa69183ffa557ca13ab78c6e706b59712bafcaf0"},"transformations":["earnings_yield_minus_bond_yield","rolling_empirical_rank","1.0.0"]},"research_only":true,"research_summary":{"conditions":["earnings_yield_minus_bond_yield","rolling_empirical_percentile"],"counterexamples":["middle_percentile_has_no_extreme_signal"],"data_cutoff":"2026-09-16","failure_conditions":["pe_definition_or_bond_yield_maturity_changes","loss_making_index_or_nonpositive_pe","structural_valuation_regime_change"],"sample_size":5},"row_delivery":{"dataset_refs_reused":true,"inline_output_rows":3,"mode":"inline","omitted_output_rows":0,"processed_input_rows":5},"rows":[{"bond_yield_pct":3.0,"date":"2026-09-12","index_close":3980.0,"pe_ttm":25.0,"research_signal":"middle_risk_premium","risk_premium":0.010000000000000002,"rolling_percentile":0.3333333333333333},{"bond_yield_pct":2.5,"date":"2026-09-15","index_close":4010.0,"pe_ttm":20.0,"research_signal":"middle_risk_premium","risk_premium":0.025,"rolling_percentile":0.6666666666666666},{"bond_yield_pct":2.5,"date":"2026-09-16","index_close":4050.0,"pe_ttm":16.0,"research_signal":"elevated_risk_premium","risk_premium":0.0375,"rolling_percentile":1.0}],"skill_slug":"equity-risk-premium-timing","status":"complete"}
